hotspot_id,location,issue_type,symptoms,operational_impact,suspected_root_cause,urgency
H-001,configs/data/tomics_multidataset_candidates/traitenv_candidate_registry.json,runtime-status-drift,Runnable and draft semantics can drift from fixture evidence,Gate denominator or blocker reports can become misleading,Dataset status is config-driven and must match contracts metadata and tests,high
H-002,src/stomatal_optimiaztion/domains/tomato/tomics/alloc/validation/datasets/metadata.py,proxy-caveat-visibility,Derived dry-weight datasets can look like direct measured DW if review flags are hidden,Scientific claims and promotion reports can overstate evidence,Scorecard payloads need explicit direct-vs-derived fields,high
H-003,configs/data/knu_private_data_contract.template.yaml,private-fixture-boundary,Local KNU fixture paths are needed but raw/private data cannot be committed,Runtime validation can work locally while PR review must remain safe,Contract template plus gitignore must carry the boundary,high
H-004,.rah/,local-runtime-state,RAH restart packets can point at retired issue branches after merges,Future sessions can resume stale branches or scopes,RAH sidecar is local control-plane state and should be ignored unless explicitly promoted,medium
H-005,scripts/run_tomics_multidataset_harvest_promotion_gate.py,gate-scope-creep,Mixed measured gate can be confused with public promotion semantics,Review can block if public/private semantics are not separated,Config names and docs must keep mixed/public lanes explicit,medium
